log/simple_model_onnx2trt.log
[02/27/2025-14:25:51] [V] [TRT] *************** Autotuning Reformat: Float(3,1) -> Half(3,1) ***************
[02/27/2025-14:25:51] [V] [TRT] --------------- Timing Runner: Optimizer Reformat(input -> <out>) (Reformat)
[02/27/2025-14:25:51] [V] [TRT] Tactic: 0x00000000000003e8 Time: 0.0051231
[02/27/2025-14:25:51] [V] [TRT] Tactic: 0x00000000000003ea Time: 0.0128011
[02/27/2025-14:25:51] [V] [TRT] Tactic: 0x0000000000000000 Time: 0.00544186
[02/27/2025-14:25:51] [V] [TRT] Fastest Tactic: 0x00000000000003e8 Time: 0.0051231
[02/27/2025-14:25:51] [V] [TRT] =============== Computing reformatting costs: 
[02/27/2025-14:25:51] [V] [TRT] *************** Autotuning Reformat: Float(3,1,1,1) -> Float(3,1,3,3) ***************
[02/27/2025-14:25:51] [V] [TRT] --------------- Timing Runner: Optimizer Reformat(reshape_before_/fc1/Gemm_out_tensor -> <out>) (Reformat)
[02/27/2025-14:25:51] [V] [TRT] Tactic: 0x00000000000003e8 Time: 0.00617886
[02/27/2025-14:25:51] [V] [TRT] Tactic: 0x00000000000003ea Time: 0.0138219
[02/27/2025-14:25:51] [V] [TRT] Tactic: 0x0000000000000000 Time: 0.00766519
[02/27/2025-14:25:51] [V] [TRT] Fastest Tactic: 0x00000000000003e8 Time: 0.00617886
[02/27/2025-14:25:51] [V] [TRT] *************** Autotuning Reformat: Float(3,1,1,1) -> Float(1,1:4,1,1) ***************
[02/27/2025-14:25:51] [V] [TRT] --------------- Timing Runner: Optimizer Reformat(reshape_before_/fc1/Gemm_out_tensor -> <out>) (Reformat)
[02/27/2025-14:25:51] [V] [TRT] Tactic: 0x00000000000003e8 Time: 0.00605391
[02/27/2025-14:25:51] [V] [TRT] Tactic: 0x00000000000003ea Time: 0.0128697
[02/27/2025-14:25:51] [V] [TRT] Tactic: 0x0000000000000000 Time: 0.00606
[02/27/2025-14:25:51] [V] [TRT] Fastest Tactic: 0x00000000000003e8 Time: 0.00605391
[02/27/2025-14:25:51] [V] [TRT] *************** Autotuning Reformat: Float(3,1,1,1) -> Half(3,1,1,1) ***************
[02/27/2025-14:25:51] [V] [TRT] --------------- Timing Runner: Optimizer Reformat(reshape_before_/fc1/Gemm_out_tensor -> <out>) (Reformat)
[02/27/2025-14:25:51] [V] [TRT] Tactic: 0x00000000000003e8 Time: 0.00541003
[02/27/2025-14:25:51] [V] [TRT] Tactic: 0x00000000000003ea Time: 0.012619
[02/27/2025-14:25:51] [V] [TRT] Tactic: 0x0000000000000000 Time: 0.00574464
[02/27/2025-14:25:51] [V] [TRT] Fastest Tactic: 0x00000000000003e8 Time: 0.00541003
[02/27/2025-14:25:51] [V] [TRT] *************** Autotuning Reformat: Float(3,1,1,1) -> Half(2,1:2,1,1) ***************
[02/27/2025-14:25:51] [V] [TRT] --------------- Timing Runner: Optimizer Reformat(reshape_before_/fc1/Gemm_out_tensor -> <out>) (Reformat)
[02/27/2025-14:25:51] [V] [TRT] Tactic: 0x00000000000003e8 Time: 0.00540614
[02/27/2025-14:25:51] [V] [TRT] Tactic: 0x00000000000003ea Time: 0.0262459
[02/27/2025-14:25:51] [V] [TRT] Tactic: 0x0000000000000000 Time: 0.0115015
[02/27/2025-14:25:51] [V] [TRT] Fastest Tactic: 0x00000000000003e8 Time: 0.00540614
[02/27/2025-14:25:51] [V] [TRT] *************** Autotuning Reformat: Float(3,1,1,1) -> Half(1,1:4,1,1) ***************
[02/27/2025-14:25:51] [V] [TRT] --------------- Timing Runner: Optimizer Reformat(reshape_before_/fc1/Gemm_out_tensor -> <out>) (Reformat)
[02/27/2025-14:25:51] [V] [TRT] Tactic: 0x00000000000003e8 Time: 0.0294162
[02/27/2025-14:25:51] [V] [TRT] Tactic: 0x00000000000003ea Time: 0.0125832
[02/27/2025-14:25:51] [V] [TRT] Tactic: 0x0000000000000000 Time: 0.00599371
[02/27/2025-14:25:51] [V] [TRT] Fastest Tactic: 0x0000000000000000 Time: 0.00599371
[02/27/2025-14:25:51] [V] [TRT] *************** Autotuning Reformat: Float(3,1,1,1) -> Half(1,1:8,1,1) ***************
[02/27/2025-14:25:51] [V] [TRT] --------------- Timing Runner: Optimizer Reformat(reshape_before_/fc1/Gemm_out_tensor -> <out>) (Reformat)
[02/27/2025-14:25:51] [V] [TRT] Tactic: 0x00000000000003e8 Time: 0.00529829
[02/27/2025-14:25:51] [V] [TRT] Tactic: 0x00000000000003ea Time: 0.0120838
[02/27/2025-14:25:51] [V] [TRT] Tactic: 0x0000000000000000 Time: 0.00555991
[02/27/2025-14:25:51] [V] [TRT] Fastest Tactic: 0x00000000000003e8 Time: 0.00529829
[02/27/2025-14:25:51] [V] [TRT] *************** Autotuning Reformat: Float(3,1,1,1) -> Half(1,1:16,1,1) ***************
[02/27/2025-14:25:51] [V] [TRT] --------------- Timing Runner: Optimizer Reformat(reshape_before_/fc1/Gemm_out_tensor -> <out>) (Reformat)
[02/27/2025-14:25:51] [V] [TRT] Tactic: 0x00000000000003e8 Time: 0.00556941
[02/27/2025-14:25:51] [V] [TRT] Tactic: 0x00000000000003ea Time: 0.0120274
[02/27/2025-14:25:51] [V] [TRT] Tactic: 0x0000000000000000 Time: 0.00573349
[02/27/2025-14:25:51] [V] [TRT] Fastest Tactic: 0x00000000000003e8 Time: 0.00556941
[02/27/2025-14:25:51] [V] [TRT] *************** Autotuning Reformat: Float(3,1,3,3) -> Float(3,1,1,1) ***************
[02/27/2025-14:25:51] [V] [TRT] --------------- Timing Runner: Optimizer Reformat(reshape_before_/fc1/Gemm_out_tensor -> <out>) (Reformat)
[02/27/2025-14:25:51] [V] [TRT] Tactic: 0x00000000000003e8 Time: 0.0053909
[02/27/2025-14:25:51] [V] [TRT] Tactic: 0x00000000000003ea Time: 0.0126248
[02/27/2025-14:25:51] [V] [TRT] Tactic: 0x0000000000000000 Time: 0.00558804
[02/27/2025-14:25:51] [V] [TRT] Fastest Tactic: 0x00000000000003e8 Time: 0.0053909
[02/27/2025-14:25:51] [V] [TRT] *************** Autotuning Reformat: Float(3,1,3,3) -> Float(1,1:4,1,1) ***************
[02/27/2025-14:25:51] [V] [TRT] --------------- Timing Runner: Optimizer Reformat(reshape_before_/fc1/Gemm_out_tensor -> <out>) (Reformat)
[02/27/2025-14:25:51] [V] [TRT] Tactic: 0x00000000000003e8 Time: 0.00548978
[02/27/2025-14:25:51] [V] [TRT] Tactic: 0x00000000000003ea Time: 0.0124297
[02/27/2025-14:25:51] [V] [TRT] Tactic: 0x0000000000000000 Time: 0.0552674
[02/27/2025-14:25:51] [V] [TRT] Fastest Tactic: 0x00000000000003e8 Time: 0.00548978
[02/27/2025-14:25:51] [V] [TRT] *************** Autotuning Reformat: Float(3,1,3,3) -> Half(3,1,1,1) ***************
[02/27/2025-14:25:51] [V] [TRT] --------------- Timing Runner: Optimizer Reformat(reshape_before_/fc1/Gemm_out_tensor -> <out>) (Reformat)
[02/27/2025-14:25:51] [V] [TRT] Tactic: 0x00000000000003e8 Time: 0.00561512
[02/27/2025-14:25:51] [V] [TRT] Tactic: 0x00000000000003ea Time: 0.0123173
[02/27/2025-14:25:51] [V] [TRT] Tactic: 0x0000000000000000 Time: 0.00596076
[02/27/2025-14:25:51] [V] [TRT] Fastest Tactic: 0x00000000000003e8 Time: 0.00561512
[02/27/2025-14:25:51] [V] [TRT] *************** Autotuning Reformat: Float(3,1,3,3) -> Half(2,1:2,1,1) ***************
[02/27/2025-14:25:51] [V] [TRT] --------------- Timing Runner: Optimizer Reformat(reshape_before_/fc1/Gemm_out_tensor -> <out>) (Reformat)
[02/27/2025-14:25:51] [V] [TRT] Tactic: 0x00000000000003e8 Time: 0.01996
[02/27/2025-14:25:51] [V] [TRT] Tactic: 0x00000000000003ea Time: 0.0116807
[02/27/2025-14:25:51] [V] [TRT] Tactic: 0x0000000000000000 Time: 0.00529304
[02/27/2025-14:25:51] [V] [TRT] Fastest Tactic: 0x0000000000000000 Time: 0.00529304
[02/27/2025-14:25:51] [V] [TRT] *************** Autotuning Reformat: Float(3,1,3,3) -> Half(1,1:4,1,1) ***************
[02/27/2025-14:25:51] [V] [TRT] --------------- Timing Runner: Optimizer Reformat(reshape_before_/fc1/Gemm_out_tensor -> <out>) (Reformat)
[02/27/2025-14:25:51] [V] [TRT] Tactic: 0x00000000000003e8 Time: 0.00565363
[02/27/2025-14:25:51] [V] [TRT] Tactic: 0x00000000000003ea Time: 0.0123924
[02/27/2025-14:25:51] [V] [TRT] Tactic: 0x0000000000000000 Time: 0.00576512
[02/27/2025-14:25:51] [V] [TRT] Fastest Tactic: 0x00000000000003e8 Time: 0.00565363
[02/27/2025-14:25:51] [V] [TRT] *************** Autotuning Reformat: Float(3,1,3,3) -> Half(1,1:8,1,1) ***************
[02/27/2025-14:25:51] [V] [TRT] --------------- Timing Runner: Optimizer Reformat(reshape_before_/fc1/Gemm_out_tensor -> <out>) (Reformat)
[02/27/2025-14:25:51] [V] [TRT] Tactic: 0x00000000000003e8 Time: 0.005168
[02/27/2025-14:25:51] [V] [TRT] Tactic: 0x00000000000003ea Time: 0.0121669
[02/27/2025-14:25:51] [V] [TRT] Tactic: 0x0000000000000000 Time: 0.00530574
[02/27/2025-14:25:51] [V] [TRT] Fastest Tactic: 0x00000000000003e8 Time: 0.005168
[02/27/2025-14:25:51] [V] [TRT] *************** Autotuning Reformat: Float(3,1,3,3) -> Half(1,1:16,1,1) ***************
[02/27/2025-14:25:51] [V] [TRT] --------------- Timing Runner: Optimizer Reformat(reshape_before_/fc1/Gemm_out_tensor -> <out>) (Reformat)
[02/27/2025-14:25:51] [V] [TRT] Tactic: 0x00000000000003e8 Time: 0.00543915
[02/27/2025-14:25:51] [V] [TRT] Tactic: 0x00000000000003ea Time: 0.0118639
[02/27/2025-14:25:51] [V] [TRT] Tactic: 0x0000000000000000 Time: 0.00554022
[02/27/2025-14:25:51] [V] [TRT] Fastest Tactic: 0x00000000000003e8 Time: 0.00543915
[02/27/2025-14:25:51] [V] [TRT] *************** Autotuning Reformat: Float(1,1:4,1,1) -> Float(3,1,1,1) ***************
[02/27/2025-14:25:51] [V] [TRT] --------------- Timing Runner: Optimizer Reformat(reshape_before_/fc1/Gemm_out_tensor -> <out>) (Reformat)
[02/27/2025-14:25:51] [V] [TRT] Tactic: 0x00000000000003e8 Time: 0.0179217
[02/27/2025-14:25:51] [V] [TRT] Tactic: 0x00000000000003ea Time: 0.0119672
[02/27/2025-14:25:51] [V] [TRT] Tactic: 0x0000000000000000 Time: 0.00562585
[02/27/2025-14:25:51] [V] [TRT] Fastest Tactic: 0x0000000000000000 Time: 0.00562585
[02/27/2025-14:25:51] [V] [TRT] *************** Autotuning Reformat: Float(1,1:4,1,1) -> Float(3,1,3,3) ***************
[02/27/2025-14:25:51] [V] [TRT] --------------- Timing Runner: Optimizer Reformat(reshape_before_/fc1/Gemm_out_tensor -> <out>) (Reformat)
[02/27/2025-14:25:51] [V] [TRT] Tactic: 0x00000000000003e8 Time: 0.00552369
[02/27/2025-14:25:51] [V] [TRT] Tactic: 0x00000000000003ea Time: 0.0120762
[02/27/2025-14:25:51] [V] [TRT] Tactic: 0x0000000000000000 Time: 0.00579383
[02/27/2025-14:25:51] [V] [TRT] Fastest Tactic: 0x00000000000003e8 Time: 0.00552369
[02/27/2025-14:25:51] [V] [TRT] *************** Autotuning Reformat: Float(1,1:4,1,1) -> Half(3,1,1,1) ***************
[02/27/2025-14:25:51] [V] [TRT] --------------- Timing Runner: Optimizer Reformat(reshape_before_/fc1/Gemm_out_tensor -> <out>) (Reformat)
[02/27/2025-14:25:51] [V] [TRT] Tactic: 0x00000000000003e8 Time: 0.006
[02/27/2025-14:25:51] [V] [TRT] Tactic: 0x00000000000003ea Time: 0.0122419
[02/27/2025-14:25:51] [V] [TRT] Tactic: 0x0000000000000000 Time: 0.00619486
[02/27/2025-14:25:51] [V] [TRT] Fastest Tactic: 0x00000000000003e8 Time: 0.006
[02/27/2025-14:25:51] [V] [TRT] *************** Autotuning Reformat: Float(1,1:4,1,1) -> Half(2,1:2,1,1) ***************
[02/27/2025-14:25:51] [V] [TRT] --------------- Timing Runner: Optimizer Reformat(reshape_before_/fc1/Gemm_out_tensor -> <out>) (Reformat)
[02/27/2025-14:25:51] [V] [TRT] Tactic: 0x00000000000003e8 Time: 0.00541782
[02/27/2025-14:25:51] [V] [TRT] Tactic: 0x00000000000003ea Time: 0.0272528
[02/27/2025-14:25:51] [V] [TRT] Tactic: 0x0000000000000000 Time: 0.0056684
[02/27/2025-14:25:51] [V] [TRT] Fastest Tactic: 0x00000000000003e8 Time: 0.00541782
[02/27/2025-14:25:51] [V] [TRT] *************** Autotuning Reformat: Float(1,1:4,1,1) -> Half(1,1:4,1,1) ***************
[02/27/2025-14:25:51] [V] [TRT] --------------- Timing Runner: Optimizer Reformat(reshape_before_/fc1/Gemm_out_tensor -> <out>) (Reformat)
[02/27/2025-14:25:51] [V] [TRT] Tactic: 0x00000000000003e8 Time: 0.00587045
[02/27/2025-14:25:51] [V] [TRT] Tactic: 0x00000000000003ea Time: 0.0122686
[02/27/2025-14:25:51] [V] [TRT] Tactic: 0x0000000000000000 Time: 0.00588087
[02/27/2025-14:25:51] [V] [TRT] Fastest Tactic: 0x00000000000003e8 Time: 0.00587045
[02/27/2025-14:25:51] [V] [TRT] *************** Autotuning Reformat: Float(1,1:4,1,1) -> Half(1,1:8,1,1) ***************
[02/27/2025-14:25:51] [V] [TRT] --------------- Timing Runner: Optimizer Reformat(reshape_before_/fc1/Gemm_out_tensor -> <out>) (Reformat)
[02/27/2025-14:25:51] [V] [TRT] Tactic: 0x00000000000003e8 Time: 0.00544423
[02/27/2025-14:25:51] [V] [TRT] Tactic: 0x00000000000003ea Time: 0.0113058
[02/27/2025-14:25:51] [V] [TRT] Tactic: 0x0000000000000000 Time: 0.0164501
[02/27/2025-14:25:51] [V] [TRT] Fastest Tactic: 0x00000000000003e8 Time: 0.00544423
[02/27/2025-14:25:51] [V] [TRT] *************** Autotuning Reformat: Float(1,1:4,1,1) -> Half(1,1:16,1,1) ***************
[02/27/2025-14:25:51] [V] [TRT] --------------- Timing Runner: Optimizer Reformat(reshape_before_/fc1/Gemm_out_tensor -> <out>) (Reformat)
[02/27/2025-14:25:51] [V] [TRT] Tactic: 0x00000000000003e8 Time: 0.00573989
[02/27/2025-14:25:51] [V] [TRT] Tactic: 0x00000000000003ea Time: 0.0119444
[02/27/2025-14:25:51] [V] [TRT] Tactic: 0x0000000000000000 Time: 0.00581961
[02/27/2025-14:25:51] [V] [TRT] Fastest Tactic: 0x00000000000003e8 Time: 0.00573989
[02/27/2025-14:25:51] [V] [TRT] *************** Autotuning Reformat: Half(3,1,1,1) -> Float(3,1,1,1) ***************
[02/27/2025-14:25:51] [V] [TRT] --------------- Timing Runner: Optimizer Reformat(reshape_before_/fc1/Gemm_out_tensor -> <out>) (Reformat)
[02/27/2025-14:25:51] [V] [TRT] Tactic: 0x00000000000003e8 Time: 0.00511984
[02/27/2025-14:25:51] [V] [TRT] Tactic: 0x00000000000003ea Time: 0.0121737
[02/27/2025-14:25:51] [V] [TRT] Tactic: 0x0000000000000000 Time: 0.00561371
[02/27/2025-14:25:51] [V] [TRT] Fastest Tactic: 0x00000000000003e8 Time: 0.00511984
[02/27/2025-14:25:51] [V] [TRT] *************** Autotuning Reformat: Half(3,1,1,1) -> Float(3,1,3,3) ***************
[02/27/2025-14:25:51] [V] [TRT] --------------- Timing Runner: Optimizer Reformat(reshape_before_/fc1/Gemm_out_tensor -> <out>) (Reformat)
[02/27/2025-14:25:51] [V] [TRT] Tactic: 0x00000000000003e8 Time: 0.00575781
[02/27/2025-14:25:51] [V] [TRT] Tactic: 0x00000000000003ea Time: 0.012187
[02/27/2025-14:25:51] [V] [TRT] Tactic: 0x0000000000000000 Time: 0.00583314
[02/27/2025-14:25:51] [V] [TRT] Fastest Tactic: 0x00000000000003e8 Time: 0.00575781
[02/27/2025-14:25:51] [V] [TRT] *************** Autotuning Reformat: Half(3,1,1,1) -> Float(1,1:4,1,1) ***************
[02/27/2025-14:25:51] [V] [TRT] --------------- Timing Runner: Optimizer Reformat(reshape_before_/fc1/Gemm_out_tensor -> <out>) (Reformat)
[02/27/2025-14:25:51] [V] [TRT] Tactic: 0x00000000000003e8 Time: 0.00604876
[02/27/2025-14:25:51] [V] [TRT] Tactic: 0x00000000000003ea Time: 0.0123337
[02/27/2025-14:25:51] [V] [TRT] Tactic: 0x0000000000000000 Time: 0.00615162
[02/27/2025-14:25:51] [V] [TRT] Fastest Tactic: 0x00000000000003e8 Time: 0.00604876
[02/27/2025-14:25:51] [V] [TRT] *************** Autotuning Reformat: Half(3,1,1,1) -> Half(2,1:2,1,1) ***************
[02/27/2025-14:25:51] [V] [TRT] --------------- Timing Runner: Optimizer Reformat(reshape_before_/fc1/Gemm_out_tensor -> <out>) (Reformat)
[02/27/2025-14:25:51] [V] [TRT] Tactic: 0x00000000000003e8 Time: 0.00554057
[02/27/2025-14:25:51] [V] [TRT] Tactic: 0x00000000000003ea Time: 0.0109443
[02/27/2025-14:25:51] [V] [TRT] Tactic: 0x0000000000000000 Time: 0.00514922
[02/27/2025-14:25:51] [V] [TRT] Fastest Tactic: 0x0000000000000000 Time: 0.00514922
[02/27/2025-14:25:51] [V] [TRT] *************** Autotuning Reformat: Half(3,1,1,1) -> Half(1,1:4,1,1) ***************
[02/27/2025-14:25:51] [V] [TRT] --------------- Timing Runner: Optimizer Reformat(reshape_before_/fc1/Gemm_out_tensor -> <out>) (Reformat)
[02/27/2025-14:25:51] [V] [TRT] Tactic: 0x00000000000003e8 Time: 0.00597924
[02/27/2025-14:25:51] [V] [TRT] Tactic: 0x00000000000003ea Time: 0.0349234
[02/27/2025-14:25:51] [V] [TRT] Tactic: 0x0000000000000000 Time: 0.00608
[02/27/2025-14:25:51] [V] [TRT] Fastest Tactic: 0x00000000000003e8 Time: 0.00597924
[02/27/2025-14:25:51] [V] [TRT] *************** Autotuning Reformat: Half(3,1,1,1) -> Half(1,1:8,1,1) ***************
[02/27/2025-14:25:51] [V] [TRT] --------------- Timing Runner: Optimizer Reformat(reshape_before_/fc1/Gemm_out_tensor -> <out>) (Reformat)
[02/27/2025-14:25:51] [V] [TRT] Tactic: 0x00000000000003e8 Time: 0.00574921
[02/27/2025-14:25:51] [V] [TRT] Tactic: 0x00000000000003ea Time: 0.0119554
[02/27/2025-14:25:51] [V] [TRT] Tactic: 0x0000000000000000 Time: 0.0058304
[02/27/2025-14:25:51] [V] [TRT] Fastest Tactic: 0x00000000000003e8 Time: 0.00574921
[02/27/2025-14:25:51] [V] [TRT] *************** Autotuning Reformat: Half(3,1,1,1) -> Half(1,1:16,1,1) ***************
[02/27/2025-14:25:51] [V] [TRT] --------------- Timing Runner: Optimizer Reformat(reshape_before_/fc1/Gemm_out_tensor -> <out>) (Reformat)
[02/27/2025-14:25:51] [V] [TRT] Tactic: 0x00000000000003e8 Time: 0.00586953
[02/27/2025-14:25:51] [V] [TRT] Tactic: 0x00000000000003ea Time: 0.0120922
[02/27/2025-14:25:51] [V] [TRT] Tactic: 0x0000000000000000 Time: 0.00603562
[02/27/2025-14:25:51] [V] [TRT] Fastest Tactic: 0x00000000000003e8 Time: 0.00586953
[02/27/2025-14:25:51] [V] [TRT] *************** Autotuning Reformat: Half(2,1:2,1,1) -> Float(3,1,1,1) ***************
[02/27/2025-14:25:51] [V] [TRT] --------------- Timing Runner: Optimizer Reformat(reshape_before_/fc1/Gemm_out_tensor -> <out>) (Reformat)
[02/27/2025-14:25:51] [V] [TRT] Tactic: 0x00000000000003e8 Time: 0.00516686
[02/27/2025-14:25:51] [V] [TRT] Tactic: 0x00000000000003ea Time: 0.0113136
[02/27/2025-14:25:51] [V] [TRT] Tactic: 0x0000000000000000 Time: 0.00481981
[02/27/2025-14:25:51] [V] [TRT] Fastest Tactic: 0x0000000000000000 Time: 0.00481981
[02/27/2025-14:25:51] [V] [TRT] *************** Autotuning Reformat: Half(2,1:2,1,1) -> Float(3,1,3,3) ***************
[02/27/2025-14:25:51] [V] [TRT] --------------- Timing Runner: Optimizer Reformat(reshape_before_/fc1/Gemm_out_tensor -> <out>) (Reformat)
[02/27/2025-14:25:51] [V] [TRT] Tactic: 0x00000000000003e8 Time: 0.00519853
[02/27/2025-14:25:51] [V] [TRT] Tactic: 0x00000000000003ea Time: 0.0113375
[02/27/2025-14:25:51] [V] [TRT] Tactic: 0x0000000000000000 Time: 0.0551474
[02/27/2025-14:25:51] [V] [TRT] Fastest Tactic: 0x00000000000003e8 Time: 0.00519853
[02/27/2025-14:25:51] [V] [TRT] *************** Autotuning Reformat: Half(2,1:2,1,1) -> Float(1,1:4,1,1) ***************
[02/27/2025-14:25:51] [V] [TRT] --------------- Timing Runner: Optimizer Reformat(reshape_before_/fc1/Gemm_out_tensor -> <out>) (Reformat)
[02/27/2025-14:25:51] [V] [TRT] Tactic: 0x00000000000003e8 Time: 0.00539615
[02/27/2025-14:25:51] [V] [TRT] Tactic: 0x00000000000003ea Time: 0.0114908
[02/27/2025-14:25:51] [V] [TRT] Tactic: 0x0000000000000000 Time: 0.00570303
[02/27/2025-14:25:51] [V] [TRT] Fastest Tactic: 0x00000000000003e8 Time: 0.00539615
[02/27/2025-14:25:51] [V] [TRT] *************** Autotuning Reformat: Half(2,1:2,1,1) -> Half(3,1,1,1) ***************
[02/27/2025-14:25:51] [V] [TRT] --------------- Timing Runner: Optimizer Reformat(reshape_before_/fc1/Gemm_out_tensor -> <out>) (Reformat)
[02/27/2025-14:25:51] [V] [TRT] Tactic: 0x00000000000003e8 Time: 0.00553442
[02/27/2025-14:25:51] [V] [TRT] Tactic: 0x00000000000003ea Time: 0.0402679
[02/27/2025-14:25:51] [V] [TRT] Tactic: 0x0000000000000000 Time: 0.00497403
[02/27/2025-14:25:51] [V] [TRT] Fastest Tactic: 0x0000000000000000 Time: 0.00497403
[02/27/2025-14:25:51] [V] [TRT] *************** Autotuning Reformat: Half(2,1:2,1,1) -> Half(1,1:4,1,1) ***************
[02/27/2025-14:25:51] [V] [TRT] --------------- Timing Runner: Optimizer Reformat(reshape_before_/fc1/Gemm_out_tensor -> <out>) (Reformat)
[02/27/2025-14:25:51] [V] [TRT] Tactic: 0x00000000000003e8 Time: 0.00557802
[02/27/2025-14:25:51] [V] [TRT] Tactic: 0x00000000000003ea Time: 0.0120815
[02/27/2025-14:25:51] [V] [TRT] Tactic: 0x0000000000000000 Time: 0.00576494
[02/27/2025-14:25:51] [V] [TRT] Fastest Tactic: 0x00000000000003e8 Time: 0.00557802
[02/27/2025-14:25:51] [V] [TRT] *************** Autotuning Reformat: Half(2,1:2,1,1) -> Half(1,1:8,1,1) ***************
[02/27/2025-14:25:51] [V] [TRT] --------------- Timing Runner: Optimizer Reformat(reshape_before_/fc1/Gemm_out_tensor -> <out>) (Reformat)
[02/27/2025-14:25:51] [V] [TRT] Tactic: 0x00000000000003e8 Time: 0.00485669
[02/27/2025-14:25:51] [V] [TRT] Tactic: 0x00000000000003ea Time: 0.0112049
[02/27/2025-14:25:51] [V] [TRT] Tactic: 0x0000000000000000 Time: 0.00507681
[02/27/2025-14:25:51] [V] [TRT] Fastest Tactic: 0x00000000000003e8 Time: 0.00485669
[02/27/2025-14:25:51] [V] [TRT] *************** Autotuning Reformat: Half(2,1:2,1,1) -> Half(1,1:16,1,1) ***************
[02/27/2025-14:25:51] [V] [TRT] --------------- Timing Runner: Optimizer Reformat(reshape_before_/fc1/Gemm_out_tensor -> <out>) (Reformat)
[02/27/2025-14:25:51] [V] [TRT] Tactic: 0x00000000000003e8 Time: 0.00523167
[02/27/2025-14:25:51] [V] [TRT] Tactic: 0x00000000000003ea Time: 0.011309
[02/27/2025-14:25:51] [V] [TRT] Tactic: 0x0000000000000000 Time: 0.00550857
[02/27/2025-14:25:51] [V] [TRT] Fastest Tactic: 0x00000000000003e8 Time: 0.00523167
[02/27/2025-14:25:51] [V] [TRT] *************** Autotuning Reformat: Half(1,1:4,1,1) -> Float(3,1,1,1) ***************
[02/27/2025-14:25:51] [V] [TRT] --------------- Timing Runner: Optimizer Reformat(reshape_before_/fc1/Gemm_out_tensor -> <out>) (Reformat)
[02/27/2025-14:25:51] [V] [TRT] Tactic: 0x00000000000003e8 Time: 0.0199902
[02/27/2025-14:25:51] [V] [TRT] Tactic: 0x00000000000003ea Time: 0.0105793
[02/27/2025-14:25:51] [V] [TRT] Tactic: 0x0000000000000000 Time: 0.00583442
[02/27/2025-14:25:51] [V] [TRT] Fastest Tactic: 0x0000000000000000 Time: 0.00583442
[02/27/2025-14:25:51] [V] [TRT] *************** Autotuning Reformat: Half(1,1:4,1,1) -> Float(3,1,3,3) ***************
[02/27/2025-14:25:51] [V] [TRT] --------------- Timing Runner: Optimizer Reformat(reshape_before_/fc1/Gemm_out_tensor -> <out>) (Reformat)
[02/27/2025-14:25:51] [V] [TRT] Tactic: 0x00000000000003e8 Time: 0.00547454
[02/27/2025-14:25:51] [V] [TRT] Tactic: 0x00000000000003ea Time: 0.0119726
[02/27/2025-14:25:51] [V] [TRT] Tactic: 0x0000000000000000 Time: 0.00572599
[02/27/2025-14:25:51] [V] [TRT] Fastest Tactic: 0x00000000000003e8 Time: 0.00547454
[02/27/2025-14:25:51] [V] [TRT] *************** Autotuning Reformat: Half(1,1:4,1,1) -> Float(1,1:4,1,1) ***************
[02/27/2025-14:25:51] [V] [TRT] --------------- Timing Runner: Optimizer Reformat(reshape_before_/fc1/Gemm_out_tensor -> <out>) (Reformat)
[02/27/2025-14:25:51] [V] [TRT] Tactic: 0x00000000000003e8 Time: 0.0134283
[02/27/2025-14:25:51] [V] [TRT] Tactic: 0x00000000000003ea Time: 0.0121749
[02/27/2025-14:25:51] [V] [TRT] Tactic: 0x0000000000000000 Time: 0.00600781
[02/27/2025-14:25:51] [V] [TRT] Fastest Tactic: 0x0000000000000000 Time: 0.00600781
[02/27/2025-14:25:51] [V] [TRT] *************** Autotuning Reformat: Half(1,1:4,1,1) -> Half(3,1,1,1) ***************
[02/27/2025-14:25:51] [V] [TRT] --------------- Timing Runner: Optimizer Reformat(reshape_before_/fc1/Gemm_out_tensor -> <out>) (Reformat)
[02/27/2025-14:25:51] [V] [TRT] Tactic: 0x00000000000003e8 Time: 0.00605009
[02/27/2025-14:25:51] [V] [TRT] Tactic: 0x00000000000003ea Time: 0.0123798
[02/27/2025-14:25:51] [V] [TRT] Tactic: 0x0000000000000000 Time: 0.00612933
[02/27/2025-14:25:51] [V] [TRT] Fastest Tactic: 0x00000000000003e8 Time: 0.00605009
[02/27/2025-14:25:51] [V] [TRT] *************** Autotuning Reformat: Half(1,1:4,1,1) -> Half(2,1:2,1,1) ***************
[02/27/2025-14:25:51] [V] [TRT] --------------- Timing Runner: Optimizer Reformat(reshape_before_/fc1/Gemm_out_tensor -> <out>) (Reformat)
[02/27/2025-14:25:51] [V] [TRT] Tactic: 0x00000000000003e8 Time: 0.00540038
[02/27/2025-14:25:51] [V] [TRT] Tactic: 0x00000000000003ea Time: 0.011968
[02/27/2025-14:25:51] [V] [TRT] Tactic: 0x0000000000000000 Time: 0.00571813
[02/27/2025-14:25:51] [V] [TRT] Fastest Tactic: 0x00000000000003e8 Time: 0.00540038
[02/27/2025-14:25:51] [V] [TRT] *************** Autotuning Reformat: Half(1,1:4,1,1) -> Half(1,1:8,1,1) ***************
[02/27/2025-14:25:51] [V] [TRT] --------------- Timing Runner: Optimizer Reformat(reshape_before_/fc1/Gemm_out_tensor -> <out>) (Reformat)
[02/27/2025-14:25:51] [V] [TRT] Tactic: 0x00000000000003e8 Time: 0.00545744
[02/27/2025-14:25:51] [V] [TRT] Tactic: 0x00000000000003ea Time: 0.0332688
[02/27/2025-14:25:51] [V] [TRT] Tactic: 0x0000000000000000 Time: 0.00561196
[02/27/2025-14:25:51] [V] [TRT] Fastest Tactic: 0x00000000000003e8 Time: 0.00545744
[02/27/2025-14:25:51] [V] [TRT] *************** Autotuning Reformat: Half(1,1:4,1,1) -> Half(1,1:16,1,1) ***************
[02/27/2025-14:25:51] [V] [TRT] --------------- Timing Runner: Optimizer Reformat(reshape_before_/fc1/Gemm_out_tensor -> <out>) (Reformat)
[02/27/2025-14:25:51] [V] [TRT] Tactic: 0x00000000000003e8 Time: 0.0141394
[02/27/2025-14:25:51] [V] [TRT] Tactic: 0x00000000000003ea Time: 0.0121665
[02/27/2025-14:25:51] [V] [TRT] Tactic: 0x0000000000000000 Time: 0.00583552
[02/27/2025-14:25:51] [V] [TRT] Fastest Tactic: 0x0000000000000000 Time: 0.00583552
[02/27/2025-14:25:51] [V] [TRT] *************** Autotuning Reformat: Half(1,1:8,1,1) -> Float(3,1,1,1) ***************
[02/27/2025-14:25:51] [V] [TRT] --------------- Timing Runner: Optimizer Reformat(reshape_before_/fc1/Gemm_out_tensor -> <out>) (Reformat)
[02/27/2025-14:25:51] [V] [TRT] Tactic: 0x00000000000003e8 Time: 0.00522759
[02/27/2025-14:25:51] [V] [TRT] Tactic: 0x00000000000003ea Time: 0.0114507
[02/27/2025-14:25:51] [V] [TRT] Tactic: 0x0000000000000000 Time: 0.00536669
[02/27/2025-14:25:51] [V] [TRT] Fastest Tactic: 0x00000000000003e8 Time: 0.00522759
[02/27/2025-14:25:51] [V] [TRT] *************** Autotuning Reformat: Half(1,1:8,1,1) -> Float(3,1,3,3) ***************
[02/27/2025-14:25:51] [V] [TRT] --------------- Timing Runner: Optimizer Reformat(reshape_before_/fc1/Gemm_out_tensor -> <out>) (Reformat)
[02/27/2025-14:25:51] [V] [TRT] Tactic: 0x00000000000003e8 Time: 0.0763657
[02/27/2025-14:25:51] [V] [TRT] Tactic: 0x00000000000003ea Time: 0.0113955
[02/27/2025-14:25:51] [V] [TRT] Tactic: 0x0000000000000000 Time: 0.00541833
[02/27/2025-14:25:51] [V] [TRT] Fastest Tactic: 0x0000000000000000 Time: 0.00541833
[02/27/2025-14:25:51] [V] [TRT] *************** Autotuning Reformat: Half(1,1:8,1,1) -> Float(1,1:4,1,1) ***************
[02/27/2025-14:25:51] [V] [TRT] --------------- Timing Runner: Optimizer Reformat(reshape_before_/fc1/Gemm_out_tensor -> <out>) (Reformat)
[02/27/2025-14:25:51] [V] [TRT] Tactic: 0x00000000000003e8 Time: 0.00535856
[02/27/2025-14:25:51] [V] [TRT] Tactic: 0x00000000000003ea Time: 0.0117799
[02/27/2025-14:25:51] [V] [TRT] Tactic: 0x0000000000000000 Time: 0.00565837
[02/27/2025-14:25:51] [V] [TRT] Fastest Tactic: 0x00000000000003e8 Time: 0.00535856
[02/27/2025-14:25:51] [V] [TRT] *************** Autotuning Reformat: Half(1,1:8,1,1) -> Half(3,1,1,1) ***************
[02/27/2025-14:25:51] [V] [TRT] --------------- Timing Runner: Optimizer Reformat(reshape_before_/fc1/Gemm_out_tensor -> <out>) (Reformat)
[02/27/2025-14:25:51] [V] [TRT] Tactic: 0x00000000000003e8 Time: 0.00553864
[02/27/2025-14:25:51] [V] [TRT] Tactic: 0x00000000000003ea Time: 0.012339
[02/27/2025-14:25:51] [V] [TRT] Tactic: 0x0000000000000000 Time: 0.00574519
[02/27/2025-14:25:51] [V] [TRT] Fastest Tactic: 0x00000000000003e8 Time: 0.00553864
[02/27/2025-14:25:51] [V] [TRT] *************** Autotuning Reformat: Half(1,1:8,1,1) -> Half(2,1:2,1,1) ***************
[02/27/2025-14:25:51] [V] [TRT] --------------- Timing Runner: Optimizer Reformat(reshape_before_/fc1/Gemm_out_tensor -> <out>) (Reformat)
[02/27/2025-14:25:51] [V] [TRT] Tactic: 0x00000000000003e8 Time: 0.00498365
[02/27/2025-14:25:51] [V] [TRT] Tactic: 0x00000000000003ea Time: 0.0110994
[02/27/2025-14:25:51] [V] [TRT] Tactic: 0x0000000000000000 Time: 0.00515478
[02/27/2025-14:25:51] [V] [TRT] Fastest Tactic: 0x00000000000003e8 Time: 0.00498365
[02/27/2025-14:25:51] [V] [TRT] *************** Autotuning Reformat: Half(1,1:8,1,1) -> Half(1,1:4,1,1) ***************
[02/27/2025-14:25:51] [V] [TRT] --------------- Timing Runner: Optimizer Reformat(reshape_before_/fc1/Gemm_out_tensor -> <out>) (Reformat)
[02/27/2025-14:25:51] [V] [TRT] Tactic: 0x00000000000003e8 Time: 0.0289554
[02/27/2025-14:25:51] [V] [TRT] Tactic: 0x00000000000003ea Time: 0.0119054
[02/27/2025-14:25:51] [V] [TRT] Tactic: 0x0000000000000000 Time: 0.0056589
[02/27/2025-14:25:51] [V] [TRT] Fastest Tactic: 0x0000000000000000 Time: 0.0056589
[02/27/2025-14:25:51] [V] [TRT] *************** Autotuning Reformat: Half(1,1:8,1,1) -> Half(1,1:16,1,1) ***************
[02/27/2025-14:25:51] [V] [TRT] --------------- Timing Runner: Optimizer Reformat(reshape_before_/fc1/Gemm_out_tensor -> <out>) (Reformat)
[02/27/2025-14:25:51] [V] [TRT] Tactic: 0x00000000000003e8 Time: 0.0053225
[02/27/2025-14:25:51] [V] [TRT] Tactic: 0x00000000000003ea Time: 0.0114623
[02/27/2025-14:25:51] [V] [TRT] Tactic: 0x0000000000000000 Time: 0.00545778
[02/27/2025-14:25:51] [V] [TRT] Fastest Tactic: 0x00000000000003e8 Time: 0.0053225
[02/27/2025-14:25:51] [V] [TRT] *************** Autotuning Reformat: Half(1,1:16,1,1) -> Float(3,1,1,1) ***************
[02/27/2025-14:25:51] [V] [TRT] --------------- Timing Runner: Optimizer Reformat(reshape_before_/fc1/Gemm_out_tensor -> <out>) (Reformat)
[02/27/2025-14:25:51] [V] [TRT] Tactic: 0x00000000000003e8 Time: 0.0252676
[02/27/2025-14:25:51] [V] [TRT] Tactic: 0x00000000000003ea Time: 0.0115513
[02/27/2025-14:25:51] [V] [TRT] Tactic: 0x0000000000000000 Time: 0.00554092
[02/27/2025-14:25:51] [V] [TRT] Fastest Tactic: 0x0000000000000000 Time: 0.00554092
[02/27/2025-14:25:51] [V] [TRT] *************** Autotuning Reformat: Half(1,1:16,1,1) -> Float(3,1,3,3) ***************
[02/27/2025-14:25:51] [V] [TRT] --------------- Timing Runner: Optimizer Reformat(reshape_before_/fc1/Gemm_out_tensor -> <out>) (Reformat)
[02/27/2025-14:25:51] [V] [TRT] Tactic: 0x00000000000003e8 Time: 0.00517829
[02/27/2025-14:25:51] [V] [TRT] Tactic: 0x00000000000003ea Time: 0.0117609
[02/27/2025-14:25:51] [V] [TRT] Tactic: 0x0000000000000000 Time: 0.00551596
[02/27/2025-14:25:51] [V] [TRT] Fastest Tactic: 0x00000000000003e8 Time: 0.00517829
[02/27/2025-14:25:51] [V] [TRT] *************** Autotuning Reformat: Half(1,1:16,1,1) -> Float(1,1:4,1,1) ***************
[02/27/2025-14:25:51] [V] [TRT] --------------- Timing Runner: Optimizer Reformat(reshape_before_/fc1/Gemm_out_tensor -> <out>) (Reformat)
[02/27/2025-14:25:51] [V] [TRT] Tactic: 0x00000000000003e8 Time: 0.00564712
[02/27/2025-14:25:51] [V] [TRT] Tactic: 0x00000000000003ea Time: 0.0334192
[02/27/2025-14:25:51] [V] [TRT] Tactic: 0x0000000000000000 Time: 0.00573787
[02/27/2025-14:25:51] [V] [TRT] Fastest Tactic: 0x00000000000003e8 Time: 0.00564712
[02/27/2025-14:25:51] [V] [TRT] *************** Autotuning Reformat: Half(1,1:16,1,1) -> Half(3,1,1,1) ***************
[02/27/2025-14:25:51] [V] [TRT] --------------- Timing Runner: Optimizer Reformat(reshape_before_/fc1/Gemm_out_tensor -> <out>) (Reformat)
[02/27/2025-14:25:51] [V] [TRT] Tactic: 0x00000000000003e8 Time: 0.0056313
[02/27/2025-14:25:51] [V] [TRT] Tactic: 0x00000000000003ea Time: 0.0122762
[02/27/2025-14:25:51] [V] [TRT] Tactic: 0x0000000000000000 Time: 0.00585856
[02/27/2025-14:25:51] [V] [TRT] Fastest Tactic: 0x00000000000003e8 Time: 0.0056313
[02/27/2025-14:25:51] [V] [TRT] *************** Autotuning Reformat: Half(1,1:16,1,1) -> Half(2,1:2,1,1) ***************
[02/27/2025-14:25:51] [V] [TRT] --------------- Timing Runner: Optimizer Reformat(reshape_before_/fc1/Gemm_out_tensor -> <out>) (Reformat)
[02/27/2025-14:25:51] [V] [TRT] Tactic: 0x00000000000003e8 Time: 0.00518171
[02/27/2025-14:25:51] [V] [TRT] Tactic: 0x00000000000003ea Time: 0.0120099
[02/27/2025-14:25:51] [V] [TRT] Tactic: 0x0000000000000000 Time: 0.00527184
[02/27/2025-14:25:51] [V] [TRT] Fastest Tactic: 0x00000000000003e8 Time: 0.00518171
[02/27/2025-14:25:51] [V] [TRT] *************** Autotuning Reformat: Half(1,1:16,1,1) -> Half(1,1:4,1,1) ***************
[02/27/2025-14:25:51] [V] [TRT] --------------- Timing Runner: Optimizer Reformat(reshape_before_/fc1/Gemm_out_tensor -> <out>) (Reformat)
[02/27/2025-14:25:51] [V] [TRT] Tactic: 0x00000000000003e8 Time: 0.00565521
[02/27/2025-14:25:51] [V] [TRT] Tactic: 0x00000000000003ea Time: 0.0120994
[02/27/2025-14:25:51] [V] [TRT] Tactic: 0x0000000000000000 Time: 0.0136363
[02/27/2025-14:25:51] [V] [TRT] Fastest Tactic: 0x00000000000003e8 Time: 0.00565521
[02/27/2025-14:25:51] [V] [TRT] *************** Autotuning Reformat: Half(1,1:16,1,1) -> Half(1,1:8,1,1) ***************
[02/27/2025-14:25:51] [V] [TRT] --------------- Timing Runner: Optimizer Reformat(reshape_before_/fc1/Gemm_out_tensor -> <out>) (Reformat)
[02/27/2025-14:25:51] [V] [TRT] Tactic: 0x00000000000003e8 Time: 0.00522498
[02/27/2025-14:25:51] [V] [TRT] Tactic: 0x00000000000003ea Time: 0.0116005
[02/27/2025-14:25:51] [V] [TRT] Tactic: 0x0000000000000000 Time: 0.00551385
[02/27/2025-14:25:51] [V] [TRT] Fastest Tactic: 0x00000000000003e8 Time: 0.00522498
[02/27/2025-14:25:51] [V] [TRT] =============== Computing reformatting costs: 
[02/27/2025-14:25:51] [V] [TRT] *************** Autotuning Reformat: Float(3,1,1,1) -> Float(3,1,3,3) ***************
[02/27/2025-14:25:51] [V] [TRT] *************** Autotuning Reformat: Float(3,1,1,1) -> Float(1,1:4,1,1) ***************
[02/27/2025-14:25:51] [V] [TRT] *************** Autotuning Reformat: Float(3,1,1,1) -> Half(3,1,1,1) ***************
[02/27/2025-14:25:51] [V] [TRT] *************** Autotuning Reformat: Float(3,1,1,1) -> Half(2,1:2,1,1) ***************
[02/27/2025-14:25:51] [V] [TRT] *************** Autotuning Reformat: Float(3,1,1,1) -> Half(1,1:4,1,1) ***************
[02/27/2025-14:25:51] [V] [TRT] *************** Autotuning Reformat: Float(3,1,1,1) -> Half(1,1:8,1,1) ***************
[02/27/2025-14:25:51] [V] [TRT] *************** Autotuning Reformat: Float(3,1,1,1) -> Half(1,1:16,1,1) ***************
[02/27/2025-14:25:51] [V] [TRT] *************** Autotuning Reformat: Float(3,1,3,3) -> Float(3,1,1,1) ***************
[02/27/2025-14:25:51] [V] [TRT] *************** Autotuning Reformat: Float(3,1,3,3) -> Float(1,1:4,1,1) ***************
[02/27/2025-14:25:51] [V] [TRT] *************** Autotuning Reformat: Float(3,1,3,3) -> Half(3,1,1,1) ***************
[02/27/2025-14:25:51] [V] [TRT] *************** Autotuning Reformat: Float(3,1,3,3) -> Half(2,1:2,1,1) ***************
[02/27/2025-14:25:51] [V] [TRT] *************** Autotuning Reformat: Float(3,1,3,3) -> Half(1,1:4,1,1) ***************
[02/27/2025-14:25:51] [V] [TRT] *************** Autotuning Reformat: Float(3,1,3,3) -> Half(1,1:8,1,1) ***************
[02/27/2025-14:25:51] [V] [TRT] *************** Autotuning Reformat: Float(3,1,3,3) -> Half(1,1:16,1,1) ***************
[02/27/2025-14:25:51] [V] [TRT] *************** Autotuning Reformat: Float(1,1:4,1,1) -> Float(3,1,1,1) ***************
[02/27/2025-14:25:51] [V] [TRT] *************** Autotuning Reformat: Float(1,1:4,1,1) -> Float(3,1,3,3) ***************
[02/27/2025-14:25:51] [V] [TRT] *************** Autotuning Reformat: Float(1,1:4,1,1) -> Half(3,1,1,1) ***************
[02/27/2025-14:25:51] [V] [TRT] *************** Autotuning Reformat: Float(1,1:4,1,1) -> Half(2,1:2,1,1) ***************
[02/27/2025-14:25:51] [V] [TRT] *************** Autotuning Reformat: Float(1,1:4,1,1) -> Half(1,1:4,1,1) ***************
[02/27/2025-14:25:51] [V] [TRT] *************** Autotuning Reformat: Float(1,1:4,1,1) -> Half(1,1:8,1,1) ***************
[02/27/2025-14:25:51] [V] [TRT] *************** Autotuning Reformat: Float(1,1:4,1,1) -> Half(1,1:16,1,1) ***************
[02/27/2025-14:25:51] [V] [TRT] *************** Autotuning Reformat: Half(3,1,1,1) -> Float(3,1,1,1) ***************
[02/27/2025-14:25:51] [V] [TRT] *************** Autotuning Reformat: Half(3,1,1,1) -> Float(3,1,3,3) ***************
[02/27/2025-14:25:51] [V] [TRT] *************** Autotuning Reformat: Half(3,1,1,1) -> Float(1,1:4,1,1) ***************
[02/27/2025-14:25:51] [V] [TRT] *************** Autotuning Reformat: Half(3,1,1,1) -> Half(2,1:2,1,1) ***************
[02/27/2025-14:25:51] [V] [TRT] *************** Autotuning Reformat: Half(3,1,1,1) -> Half(1,1:4,1,1) ***************
[02/27/2025-14:25:51] [V] [TRT] *************** Autotuning Reformat: Half(3,1,1,1) -> Half(1,1:8,1,1) ***************
[02/27/2025-14:25:51] [V] [TRT] *************** Autotuning Reformat: Half(3,1,1,1) -> Half(1,1:16,1,1) ***************
[02/27/2025-14:25:51] [V] [TRT] *************** Autotuning Reformat: Half(2,1:2,1,1) -> Float(3,1,1,1) ***************
[02/27/2025-14:25:51] [V] [TRT] *************** Autotuning Reformat: Half(2,1:2,1,1) -> Float(3,1,3,3) ***************
[02/27/2025-14:25:51] [V] [TRT] *************** Autotuning Reformat: Half(2,1:2,1,1) -> Float(1,1:4,1,1) ***************
[02/27/2025-14:25:51] [V] [TRT] *************** Autotuning Reformat: Half(2,1:2,1,1) -> Half(3,1,1,1) ***************
[02/27/2025-14:25:51] [V] [TRT] *************** Autotuning Reformat: Half(2,1:2,1,1) -> Half(1,1:4,1,1) ***************
[02/27/2025-14:25:51] [V] [TRT] *************** Autotuning Reformat: Half(2,1:2,1,1) -> Half(1,1:8,1,1) ***************
[02/27/2025-14:25:51] [V] [TRT] *************** Autotuning Reformat: Half(2,1:2,1,1) -> Half(1,1:16,1,1) ***************
[02/27/2025-14:25:51] [V] [TRT] *************** Autotuning Reformat: Half(1,1:4,1,1) -> Float(3,1,1,1) ***************
[02/27/2025-14:25:51] [V] [TRT] *************** Autotuning Reformat: Half(1,1:4,1,1) -> Float(3,1,3,3) ***************
[02/27/2025-14:25:51] [V] [TRT] *************** Autotuning Reformat: Half(1,1:4,1,1) -> Float(1,1:4,1,1) ***************
[02/27/2025-14:25:51] [V] [TRT] *************** Autotuning Reformat: Half(1,1:4,1,1) -> Half(3,1,1,1) ***************
[02/27/2025-14:25:51] [V] [TRT] *************** Autotuning Reformat: Half(1,1:4,1,1) -> Half(2,1:2,1,1) ***************
[02/27/2025-14:25:51] [V] [TRT] *************** Autotuning Reformat: Half(1,1:4,1,1) -> Half(1,1:8,1,1) ***************
[02/27/2025-14:25:51] [V] [TRT] *************** Autotuning Reformat: Half(1,1:4,1,1) -> Half(1,1:16,1,1) ***************
[02/27/2025-14:25:51] [V] [TRT] *************** Autotuning Reformat: Half(1,1:8,1,1) -> Float(3,1,1,1) ***************
[02/27/2025-14:25:51] [V] [TRT] *************** Autotuning Reformat: Half(1,1:8,1,1) -> Float(3,1,3,3) ***************
[02/27/2025-14:25:51] [V] [TRT] *************** Autotuning Reformat: Half(1,1:8,1,1) -> Float(1,1:4,1,1) ***************
[02/27/2025-14:25:51] [V] [TRT] *************** Autotuning Reformat: Half(1,1:8,1,1) -> Half(3,1,1,1) ***************
[02/27/2025-14:25:51] [V] [TRT] *************** Autotuning Reformat: Half(1,1:8,1,1) -> Half(2,1:2,1,1) ***************
[02/27/2025-14:25:51] [V] [TRT] *************** Autotuning Reformat: Half(1,1:8,1,1) -> Half(1,1:4,1,1) ***************
[02/27/2025-14:25:51] [V] [TRT] *************** Autotuning Reformat: Half(1,1:8,1,1) -> Half(1,1:16,1,1) ***************
[02/27/2025-14:25:51] [V] [TRT] *************** Autotuning Reformat: Half(1,1:16,1,1) -> Float(3,1,1,1) ***************
[02/27/2025-14:25:51] [V] [TRT] *************** Autotuning Reformat: Half(1,1:16,1,1) -> Float(3,1,3,3) ***************
[02/27/2025-14:25:51] [V] [TRT] *************** Autotuning Reformat: Half(1,1:16,1,1) -> Float(1,1:4,1,1) ***************
[02/27/2025-14:25:51] [V] [TRT] *************** Autotuning Reformat: Half(1,1:16,1,1) -> Half(3,1,1,1) ***************
[02/27/2025-14:25:51] [V] [TRT] *************** Autotuning Reformat: Half(1,1:16,1,1) -> Half(2,1:2,1,1) ***************
[02/27/2025-14:25:51] [V] [TRT] *************** Autotuning Reformat: Half(1,1:16,1,1) -> Half(1,1:4,1,1) ***************
[02/27/2025-14:25:51] [V] [TRT] *************** Autotuning Reformat: Half(1,1:16,1,1) -> Half(1,1:8,1,1) ***************
[02/27/2025-14:25:51] [V] [TRT] =============== Computing reformatting costs: 
[02/27/2025-14:25:51] [V] [TRT] *************** Autotuning Reformat: Float(1,1,1,1) -> Half(1,1,1,1) ***************
[02/27/2025-14:25:51] [V] [TRT] --------------- Timing Runner: Optimizer Reformat(/fc2/Gemm_out_tensor -> <out>) (Reformat)
[02/27/2025-14:25:51] [V] [TRT] Tactic: 0x00000000000003e8 Time: 0.00511149
[02/27/2025-14:25:51] [V] [TRT] Tactic: 0x00000000000003ea Time: 0.0103425
[02/27/2025-14:25:51] [V] [TRT] Tactic: 0x0000000000000000 Time: 0.00526384
[02/27/2025-14:25:51] [V] [TRT] Fastest Tactic: 0x00000000000003e8 Time: 0.00511149
[02/27/2025-14:25:51] [V] [TRT] *************** Autotuning Reformat: Float(1,1,1,1) -> Half(1,1,1,1) ***************
[02/27/2025-14:25:51] [V] [TRT] *************** Autotuning Reformat: Float(1,1:4,1,1) -> Float(1,1,1,1) ***************
[02/27/2025-14:25:51] [V] [TRT] --------------- Timing Runner: Optimizer Reformat(/fc2/Gemm_out_tensor -> <out>) (Reformat)
[02/27/2025-14:25:51] [V] [TRT] Tactic: 0x00000000000003e8 Time: 0.00545744
[02/27/2025-14:25:51] [V] [TRT] Tactic: 0x00000000000003ea Time: 0.0120023
[02/27/2025-14:25:51] [V] [TRT] Tactic: 0x0000000000000000 Time: 0.00573925
[02/27/2025-14:25:51] [V] [TRT] Fastest Tactic: 0x00000000000003e8 Time: 0.00545744
[02/27/2025-14:25:51] [V] [TRT] *************** Autotuning Reformat: Float(1,1:4,1,1) -> Half(1,1,1,1) ***************
[02/27/2025-14:25:51] [V] [TRT] --------------- Timing Runner: Optimizer Reformat(/fc2/Gemm_out_tensor -> <out>) (Reformat)
[02/27/2025-14:25:51] [V] [TRT] Tactic: 0x00000000000003e8 Time: 0.0109943
[02/27/2025-14:25:51] [V] [TRT] Tactic: 0x00000000000003ea Time: 0.012552
[02/27/2025-14:25:51] [V] [TRT] Tactic: 0x0000000000000000 Time: 0.00596724
[02/27/2025-14:25:51] [V] [TRT] Fastest Tactic: 0x0000000000000000 Time: 0.00596724
[02/27/2025-14:25:51] [V] [TRT] *************** Autotuning Reformat: Half(1,1,1,1) -> Float(1,1,1,1) ***************
[02/27/2025-14:25:51] [V] [TRT] --------------- Timing Runner: Optimizer Reformat(/fc2/Gemm_out_tensor -> <out>) (Reformat)
[02/27/2025-14:25:51] [V] [TRT] Tactic: 0x00000000000003e8 Time: 0.00545778
[02/27/2025-14:25:51] [V] [TRT] Tactic: 0x00000000000003ea Time: 0.0119794
[02/27/2025-14:25:51] [V] [TRT] Tactic: 0x0000000000000000 Time: 0.00548165
[02/27/2025-14:25:51] [V] [TRT] Fastest Tactic: 0x00000000000003e8 Time: 0.00545778
[02/27/2025-14:25:51] [V] [TRT] *************** Autotuning Reformat: Half(1,1:2,1,1) -> Float(1,1,1,1) ***************
[02/27/2025-14:25:51] [V] [TRT] --------------- Timing Runner: Optimizer Reformat(/fc2/Gemm_out_tensor -> <out>) (Reformat)
[02/27/2025-14:25:51] [V] [TRT] Tactic: 0x00000000000003e8 Time: 0.00508248
[02/27/2025-14:25:51] [V] [TRT] Tactic: 0x00000000000003ea Time: 0.0117197
[02/27/2025-14:25:51] [V] [TRT] Tactic: 0x0000000000000000 Time: 0.00475679
[02/27/2025-14:25:51] [V] [TRT] Fastest Tactic: 0x0000000000000000 Time: 0.00475679
[02/27/2025-14:25:51] [V] [TRT] *************** Autotuning Reformat: Half(1,1:2,1,1) -> Half(1,1,1,1) ***************
[02/27/2025-14:25:51] [V] [TRT] --------------- Timing Runner: Optimizer Reformat(/fc2/Gemm_out_tensor -> <out>) (Reformat)
[02/27/2025-14:25:51] [V] [TRT] Tactic: 0x00000000000003e8 Time: 0.00538751
[02/27/2025-14:25:51] [V] [TRT] Tactic: 0x00000000000003ea Time: 0.0318775
[02/27/2025-14:25:51] [V] [TRT] Tactic: 0x0000000000000000 Time: 0.0241798
[02/27/2025-14:25:51] [V] [TRT] Fastest Tactic: 0x00000000000003e8 Time: 0.00538751
[02/27/2025-14:25:51] [V] [TRT] *************** Autotuning Reformat: Half(1,1:4,1,1) -> Float(1,1,1,1) ***************
[02/27/2025-14:25:51] [V] [TRT] --------------- Timing Runner: Optimizer Reformat(/fc2/Gemm_out_tensor -> <out>) (Reformat)
[02/27/2025-14:25:51] [V] [TRT] Tactic: 0x00000000000003e8 Time: 0.00541884
[02/27/2025-14:25:51] [V] [TRT] Tactic: 0x00000000000003ea Time: 0.0589425
[02/27/2025-14:25:51] [V] [TRT] Tactic: 0x0000000000000000 Time: 0.00551754
[02/27/2025-14:25:51] [V] [TRT] Fastest Tactic: 0x00000000000003e8 Time: 0.00541884
[02/27/2025-14:25:51] [V] [TRT] *************** Autotuning Reformat: Half(1,1:4,1,1) -> Half(1,1,1,1) ***************
[02/27/2025-14:25:51] [V] [TRT] --------------- Timing Runner: Optimizer Reformat(/fc2/Gemm_out_tensor -> <out>) (Reformat)
[02/27/2025-14:25:51] [V] [TRT] Tactic: 0x00000000000003e8 Time: 0.00590427
[02/27/2025-14:25:51] [V] [TRT] Tactic: 0x00000000000003ea Time: 0.012267
[02/27/2025-14:25:51] [V] [TRT] Tactic: 0x0000000000000000 Time: 0.00592805
[02/27/2025-14:25:51] [V] [TRT] Fastest Tactic: 0x00000000000003e8 Time: 0.00590427
[02/27/2025-14:25:51] [V] [TRT] *************** Autotuning Reformat: Half(1,1:8,1,1) -> Float(1,1,1,1) ***************
[02/27/2025-14:25:51] [V] [TRT] --------------- Timing Runner: Optimizer Reformat(/fc2/Gemm_out_tensor -> <out>) (Reformat)
[02/27/2025-14:25:51] [V] [TRT] Tactic: 0x00000000000003e8 Time: 0.00500666
[02/27/2025-14:25:51] [V] [TRT] Tactic: 0x00000000000003ea Time: 0.0115337
[02/27/2025-14:25:51] [V] [TRT] Tactic: 0x0000000000000000 Time: 0.00524588
[02/27/2025-14:25:51] [V] [TRT] Fastest Tactic: 0x00000000000003e8 Time: 0.00500666
[02/27/2025-14:25:51] [V] [TRT] *************** Autotuning Reformat: Half(1,1:8,1,1) -> Half(1,1,1,1) ***************
[02/27/2025-14:25:51] [V] [TRT] --------------- Timing Runner: Optimizer Reformat(/fc2/Gemm_out_tensor -> <out>) (Reformat)
[02/27/2025-14:25:51] [V] [TRT] Tactic: 0x00000000000003e8 Time: 0.00544694
[02/27/2025-14:25:51] [V] [TRT] Tactic: 0x00000000000003ea Time: 0.012123
[02/27/2025-14:25:51] [V] [TRT] Tactic: 0x0000000000000000 Time: 0.00563974
[02/27/2025-14:25:51] [V] [TRT] Fastest Tactic: 0x00000000000003e8 Time: 0.00544694
[02/27/2025-14:25:51] [V] [TRT] *************** Autotuning Reformat: Half(1,1:16,1,1) -> Float(1,1,1,1) ***************
[02/27/2025-14:25:51] [V] [TRT] --------------- Timing Runner: Optimizer Reformat(/fc2/Gemm_out_tensor -> <out>) (Reformat)
[02/27/2025-14:25:51] [V] [TRT] Tactic: 0x00000000000003e8 Time: 0.00525486
[02/27/2025-14:25:51] [V] [TRT] Tactic: 0x00000000000003ea Time: 0.011732
[02/27/2025-14:25:51] [V] [TRT] Tactic: 0x0000000000000000 Time: 0.00532758
[02/27/2025-14:25:51] [V] [TRT] Fastest Tactic: 0x00000000000003e8 Time: 0.00525486
[02/27/2025-14:25:51] [V] [TRT] *************** Autotuning Reformat: Half(1,1:16,1,1) -> Half(1,1,1,1) ***************
[02/27/2025-14:25:51] [V] [TRT] --------------- Timing Runner: Optimizer Reformat(/fc2/Gemm_out_tensor -> <out>) (Reformat)
[02/27/2025-14:25:51] [V] [TRT] Tactic: 0x00000000000003e8 Time: 0.00561284
[02/27/2025-14:25:51] [V] [TRT] Tactic: 0x00000000000003ea Time: 0.0120213
[02/27/2025-14:25:51] [V] [TRT] Tactic: 0x0000000000000000 Time: 0.00584265
[02/27/2025-14:25:51] [V] [TRT] Fastest Tactic: 0x00000000000003e8 Time: 0.00561284
[02/27/2025-14:25:51] [V] [TRT] =============== Computing reformatting costs: 
[02/27/2025-14:25:51] [V] [TRT] *************** Autotuning Reformat: Half(1,1) -> Float(1,1) ***************
[02/27/2025-14:25:51] [V] [TRT] --------------- Timing Runner: Optimizer Reformat(<in> -> output) (Reformat)
[02/27/2025-14:25:51] [V] [TRT] Tactic: 0x00000000000003e8 Time: 0.0137405
[02/27/2025-14:25:51] [V] [TRT] Tactic: 0x00000000000003ea Time: 0.0109241
[02/27/2025-14:25:51] [V] [TRT] Tactic: 0x0000000000000000 Time: 0.00436918
[02/27/2025-14:25:51] [V] [TRT] Fastest Tactic: 0x0000000000000000 Time: 0.00436918
[02/27/2025-14:25:51] [V] [TRT] =============== Computing costs for 
[02/27/2025-14:25:51] [V] [TRT] *************** Autotuning format combination: Float(3,1) -> Float(3,1,1,1) ***************
[02/27/2025-14:25:51] [V] [TRT] --------------- Timing Runner: reshape_before_/fc1/Gemm (Shuffle)
[02/27/2025-14:25:51] [V] [TRT] Tactic: 0x0000000000000000 Time: 0.0052018
[02/27/2025-14:25:51] [V] [TRT] Tactic: 0x0000000000000001 Time: 0.0193886
[02/27/2025-14:25:51] [V] [TRT] Fastest Tactic: 0x0000000000000000 Time: 0.0052018
[02/27/2025-14:25:51] [V] [TRT] >>>>>>>>>>>>>>> Chose Runner Type: Shuffle Tactic: 0x0000000000000000
[02/27/2025-14:25:51] [V] [TRT] *************** Autotuning format combination: Half(3,1) -> Half(3,1,1,1) ***************
[02/27/2025-14:25:51] [V] [TRT] --------------- Timing Runner: reshape_before_/fc1/Gemm (Shuffle)
[02/27/2025-14:25:51] [V] [TRT] Tactic: 0x0000000000000000 Time: 0.00545558
[02/27/2025-14:25:51] [V] [TRT] Tactic: 0x0000000000000001 Time: 0.0195194
[02/27/2025-14:25:51] [V] [TRT] Fastest Tactic: 0x0000000000000000 Time: 0.00545558
[02/27/2025-14:25:51] [V] [TRT] >>>>>>>>>>>>>>> Chose Runner Type: Shuffle Tactic: 0x0000000000000000
[02/27/2025-14:25:51] [V] [TRT] =============== Computing costs for 
[02/27/2025-14:25:51] [V] [TRT] *************** Autotuning format combination: Float(3,1,1,1) -> Float(3,1,1,1) ***************
[02/27/2025-14:25:51] [V] [TRT] --------------- Timing Runner: /fc1/Gemm + /relu/Relu (CudaDepthwiseConvolution)
[02/27/2025-14:25:51] [V] [TRT] CudaDepthwiseConvolution has no valid tactics for this config, skipping
[02/27/2025-14:25:51] [V] [TRT] --------------- Timing Runner: /fc1/Gemm + /relu/Relu (FusedConvActConvolution)
[02/27/2025-14:25:51] [V] [TRT] FusedConvActConvolution has no valid tactics for this config, skipping
[02/27/2025-14:25:51] [V] [TRT] --------------- Timing Runner: /fc1/Gemm + /relu/Relu (CudnnConvolution)
[02/27/2025-14:25:52] [V] [TRT] Tactic: 0x0000000000000000 Time: 0.0212225
[02/27/2025-14:25:52] [V] [TRT] Tactic: 0x0000000000000001 Time: 0.0165333
[02/27/2025-14:25:52] [V] [TRT] Tactic: 0x0000000000000002 Time: 0.0167619
[02/27/2025-14:25:52] [V] [TRT] Tactic: 0x0000000000000004 Time: 0.0365863
[02/27/2025-14:25:52] [V] [TRT] Tactic: 0x0000000000000005 Time: 0.0342821
[02/27/2025-14:25:52] [V] [TRT] Tactic: 0x0000000000000038 Time: 0.0166771
[02/27/2025-14:25:52] [V] [TRT] Tactic: 0x0000000000000039 Time: 0.0166288
[02/27/2025-14:25:52] [V] [TRT] Tactic: 0x000000000000003a Time: 0.0167817
[02/27/2025-14:25:52] [V] [TRT] Tactic: 0x000000000000003c Time: 0.0367989
[02/27/2025-14:25:52] [V] [TRT] Tactic: 0x000000000000003d Time: 0.0341431
[02/27/2025-14:25:52] [V] [TRT] Tactic: 0x0000000000000070 Time: 0.016641
[02/27/2025-14:25:52] [V] [TRT] Tactic: 0x0000000000000071 Time: 0.016573
[02/27/2025-14:25:52] [V] [TRT] Tactic: 0x0000000000000072 Time: 0.0166974
[02/27/2025-14:25:52] [V] [TRT] Tactic: 0x0000000000000074 Time: 0.037016
[02/27/2025-14:25:52] [V] [TRT] Tactic: 0x0000000000000075 Time: 0.0337975
[02/27/2025-14:25:52] [V] [TRT] Fastest Tactic: 0x0000000000000001 Time: 0.0165333
[02/27/2025-14:25:52] [V] [TRT] --------------- Timing Runner: /fc1/Gemm + /relu/Relu (CublasConvolution)
[02/27/2025-14:25:52] [V] [TRT] Tactic: 0x0000000000000000 Time: 0.0108669
[02/27/2025-14:25:52] [V] [TRT] Tactic: 0x0000000000000001 Time: 0.012757
[02/27/2025-14:25:52] [V] [TRT] Tactic: 0x0000000000000002 Time: 0.012837
[02/27/2025-14:25:52] [V] [TRT] Tactic: 0x0000000000000003 Time: 0.012616
[02/27/2025-14:25:52] [V] [TRT] Fastest Tactic: 0x0000000000000000 Time: 0.0108669
[02/27/2025-14:25:52] [V] [TRT] Unrecognized MMA instruction source format or shape: sm50_xmma_cublas_gemvx_f32f32_f32_f32_tn_n_int32_unit_n_launch_param16x32x32_strided_unit_stride
[02/27/2025-14:25:52] [V] [TRT] Unrecognized MMA instruction source format or shape: sm50_xmma_cublas_gemvx_f32f32_f32_f32_tn_n_int32_unit_n_launch_param64x2x1_strided_unit_stride
[02/27/2025-14:25:52] [V] [TRT] Unrecognized MMA instruction source format or shape: sm50_xmma_cublas_gemvx_f32f32_f32_f32_tn_n_int32_unit_n_launch_param4x32x32_strided_copyx_unit_stride
[02/27/2025-14:25:52] [V] [TRT] Unrecognized MMA instruction source format or shape: sm50_xmma_cublas_gemvx_f32f32_f32_f32_tn_n_int32_unit_n_launch_param8x32x32_strided_unit_stride
[02/27/2025-14:25:52] [V] [TRT] Unrecognized MMA instruction source format or shape: sm50_xmma_cublas_gemvx_f32f32_f32_f32_tn_n_int32_unit_n_launch_param16x32x32_strided_copyx_unit_stride
[02/27/2025-14:25:52] [V] [TRT] Unrecognized MMA instruction source format or shape: sm50_xmma_cublas_gemvx_f32f32_f32_f32_tn_n_int32_unit_n_launch_param64x2x1_strided_copyx_unit_stride
[02/27/2025-14:25:52] [V] [TRT] Unrecognized MMA instruction source format or shape: sm70_xmma_gemm_as_conv1x1_f32f32_f32_f32_tn_n_simt_small_batch_bias_relu
[02/27/2025-14:25:52] [V] [TRT] Unrecognized MMA instruction source format or shape: sm50_xmma_cublas_gemvx_f32f32_f32_f32_tn_n_int32_unit_n_launch_param8x32x32_strided_copyx_unit_stride
[02/27/2025-14:25:52] [V] [TRT] Unrecognized MMA instruction source format or shape: sm50_xmma_cublas_gemvx_f32f32_f32_f32_tn_n_int32_unit_n_launch_param4x32x32_strided_unit_stride
[02/27/2025-14:25:52] [V] [TRT] /fc1/Gemm + /relu/Relu: 24 available tactics, 24 unparsable, 0 pruned, 24 remaining after tactic pruning.
[02/27/2025-14:25:52] [V] [TRT] --------------- Timing Runner: /fc1/Gemm + /relu/Relu (CaskGemmConvolution)
[02/27/2025-14:25:52] [V] [TRT] Set Tactic Name: sm80_xmma_gemm_f32f32_f32f32_f32_tn_n_tilesize64x32x8_stage3_warpsize1x2x1_ffma_aligna4_alignc4 Tactic: 0x0000000000020343 numSplitK: 1 numBuffers: 0 numKernels: 1
[02/27/2025-14:25:52] [V] [TRT] Tactic: 0x0000000000020343 Time: 0.00615809
[02/27/2025-14:25:52] [V] [TRT] Set Tactic Name: sm50_xmma_cublas_gemvx_f32f32_f32_f32_tn_n_int32_unit_n_launch_param4x32x32_strided_unit_stride Tactic: 0x00000000000206a6 numSplitK: 1 numBuffers: 0 numKernels: 1
[02/27/2025-14:25:52] [V] [TRT] Tactic: 0x00000000000206a6 Time: 0.00526482
[02/27/2025-14:25:52] [V] [TRT] Set Tactic Name: ampere_sgemm_64x32_sliced1x4_relu_nn_v1 Tactic: 0x00000000000206a2 numSplitK: 1 numBuffers: 0 numKernels: 1
[02/27/2025-14:25:52] [V] [TRT] Tactic: 0x00000000000206a2 Time: 0.00795708
[02/27/2025-14:25:52] [V] [TRT] Set Tactic Name: ampere_sgemm_128x32_sliced1x4_relu_nn_v1 Tactic: 0x0000000000020661 numSplitK: 1 numBuffers: 0 numKernels: 1
[02/27/2025-14:25:52] [V] [TRT] Tactic: 0x0000000000020661 Time: 0.00981272
[02/27/2025-14:25:52] [V] [TRT] Set Tactic Name: ampere_sgemm_64x32_sliced1x4_nn_v1 Tactic: 0x0000000000020649 numSplitK: 1 numBuffers: 0 numKernels: 1
[02/27/2025-14:25:52] [V] [TRT] Tactic: 0x0000000000020649 Time: 0.0106968
[02/27/2025-14:25:52] [V] [TRT] Set Tactic Name: sm50_xmma_cublas_gemvx_f32f32_f32_f32_tn_n_int32_unit_n_launch_param8x32x32_strided_copyx_unit_stride Tactic: 0x0000000000020643 numSplitK: 1 numBuffers: 0 numKernels: 1
[02/27/2025-14:25:52] [V] [TRT] Tactic: 0x0000000000020643 Time: 0.00571341
[02/27/2025-14:25:52] [V] [TRT] Set Tactic Name: sm70_xmma_gemm_as_conv1x1_f32f32_f32_f32_tn_n_simt_small_batch_bias_relu Tactic: 0x0000000000020636 numSplitK: 1 numBuffers: 0 numKernels: 1
[02/27/2025-14:25:52] [V] [TRT] Tactic: 0x0000000000020636 Time: 0.00458957
[02/27/2025-14:25:52] [V] [TRT] Set Tactic Name: ampere_sgemm_32x32_sliced1x4_nn_v1 Tactic: 0x00000000000205db numSplitK: 1 numBuffers: 0 numKernels: 1
[02/27/2025-14:25:52] [V] [TRT] Tactic: 0x00000000000205db Time: 0.0100782
[02/27/2025-14:25:52] [V] [TRT] Set Tactic Name: sm50_xmma_cublas_gemvx_f32f32_f32_f32_tn_n_int32_unit_n_launch_param64x2x1_strided_copyx_unit_stride Tactic: 0x00000000000204e9 numSplitK: 1 numBuffers: 0 numKernels: 1
[02/27/2025-14:25:52] [V] [TRT] Tactic: 0x00000000000204e9 Time: 0.00547403
[02/27/2025-14:25:52] [V] [TRT] Set Tactic Name: sm50_xmma_cublas_gemvx_f32f32_f32_f32_tn_n_int32_unit_n_launch_param16x32x32_strided_copyx_unit_stride Tactic: 0x00000000000204bb numSplitK: 1 numBuffers: 0 numKernels: 1
[02/27/2025-14:25:52] [V] [TRT] Tactic: 0x00000000000204bb Time: 0.00622509
[02/27/2025-14:25:52] [V] [TRT] Set Tactic Name: ampere_sgemm_128x32_sliced1x4_tn_v1 Tactic: 0x000000000002049f numSplitK: 1 numBuffers: 0 numKernels: 1
[02/27/2025-14:25:52] [V] [TRT] Tactic: 0x000000000002049f Time: 0.0132052
[02/27/2025-14:25:52] [V] [TRT] Set Tactic Name: sm50_xmma_cublas_gemvx_f32f32_f32_f32_tn_n_int32_unit_n_launch_param8x32x32_strided_unit_stride Tactic: 0x0000000000020365 numSplitK: 1 numBuffers: 0 numKernels: 1
[02/27/2025-14:25:52] [V] [TRT] Tactic: 0x0000000000020365 Time: 0.00532385
[02/27/2025-14:25:52] [V] [TRT] Set Tactic Name: ampere_sgemm_32x32_sliced1x4_tn_v1 Tactic: 0x000000000002004a numSplitK: 1 numBuffers: 0 numKernels: 1
[02/27/2025-14:25:52] [V] [TRT] Tactic: 0x000000000002004a Time: 0.0104411
[02/27/2025-14:25:52] [V] [TRT] Set Tactic Name: sm50_xmma_cublas_gemvx_f32f32_f32_f32_tn_n_int32_unit_n_launch_param4x32x32_strided_copyx_unit_stride Tactic: 0x0000000000020315 numSplitK: 1 numBuffers: 0 numKernels: 1
[02/27/2025-14:25:52] [V] [TRT] Tactic: 0x0000000000020315 Time: 0.00561477
[02/27/2025-14:25:52] [V] [TRT] Set Tactic Name: sm50_xmma_cublas_gemvx_f32f32_f32_f32_tn_n_int32_unit_n_launch_param64x2x1_strided_unit_stride Tactic: 0x00000000000202a9 numSplitK: 1 numBuffers: 0 numKernels: 1
[02/27/2025-14:25:52] [V] [TRT] Tactic: 0x00000000000202a9 Time: 0.00504544
[02/27/2025-14:25:52] [V] [TRT] Set Tactic Name: sm50_xmma_cublas_gemvx_f32f32_f32_f32_tn_n_int32_unit_n_launch_param16x32x32_strided_unit_stride Tactic: 0x000000000002024c numSplitK: 1 numBuffers: 0 numKernels: 1
[02/27/2025-14:25:52] [V] [TRT] Tactic: 0x000000000002024c Time: 0.00542087
[02/27/2025-14:25:52] [V] [TRT] Set Tactic Name: sm80_xmma_gemm_f32f32_f32f32_f32_tn_n_tilesize32x32x8_stage3_warpsize1x2x1_ffma_aligna4_alignc4 Tactic: 0x0000000000020246 numSplitK: 1 numBuffers: 0 numKernels: 1
[02/27/2025-14:25:52] [V] [TRT] Tactic: 0x0000000000020246 Time: 0.00571959
[02/27/2025-14:25:52] [V] [TRT] Set Tactic Name: sm80_xmma_gemm_f32f32_f32f32_f32_tn_n_tilesize128x32x8_stage3_warpsize2x2x1_ffma_aligna4_alignc4 Tactic: 0x000000000002018c numSplitK: 1 numBuffers: 0 numKernels: 1
[02/27/2025-14:25:52] [V] [TRT] Tactic: 0x000000000002018c Time: 0.00605162
[02/27/2025-14:25:52] [V] [TRT] Set Tactic Name: ampere_sgemm_64x32_sliced1x4_tn_v1 Tactic: 0x0000000000020146 numSplitK: 1 numBuffers: 0 numKernels: 1
[02/27/2025-14:25:52] [V] [TRT] Tactic: 0x0000000000020146 Time: 0.0111202
[02/27/2025-14:25:52] [V] [TRT] Set Tactic Name: ampere_sgemm_32x32_sliced1x4_relu_tn_v1 Tactic: 0x0000000000020143 numSplitK: 1 numBuffers: 0 numKernels: 1
[02/27/2025-14:25:52] [V] [TRT] Tactic: 0x0000000000020143 Time: 0.00751474
[02/27/2025-14:25:52] [V] [TRT] Set Tactic Name: ampere_sgemm_64x32_sliced1x4_relu_tn_v1 Tactic: 0x00000000000200e3 numSplitK: 1 numBuffers: 0 numKernels: 1
[02/27/2025-14:25:52] [V] [TRT] Tactic: 0x00000000000200e3 Time: 0.00800102
[02/27/2025-14:25:52] [V] [TRT] Set Tactic Name: ampere_sgemm_32x32_sliced1x4_relu_nn_v1 Tactic: 0x00000000000200d6 numSplitK: 1 numBuffers: 0 numKernels: 1
[02/27/2025-14:25:52] [V] [TRT] Tactic: 0x00000000000200d6 Time: 0.01805
[02/27/2025-14:25:52] [V] [TRT] Set Tactic Name: ampere_sgemm_128x32_sliced1x4_nn_v1 Tactic: 0x00000000000200ae numSplitK: 1 numBuffers: 0 numKernels: 1
[02/27/2025-14:25:52] [V] [TRT] Tactic: 0x00000000000200ae Time: 0.0125916
[02/27/2025-14:25:52] [V] [TRT] Set Tactic Name: ampere_sgemm_128x32_sliced1x4_relu_tn_v1 Tactic: 0x0000000000020090 numSplitK: 1 numBuffers: 0 numKernels: 1
[02/27/2025-14:25:52] [V] [TRT] Tactic: 0x0000000000020090 Time: 0.0102158
[02/27/2025-14:25:52] [V] [TRT] Fastest Tactic: 0x0000000000020636 Time: 0.00458957
[02/27/2025-14:25:52] [V] [TRT] --------------- Timing Runner: /fc1/Gemm + /relu/Relu (CaskConvolution)
[02/27/2025-14:25:52] [V] [TRT] /fc1/Gemm + /relu/Relu Set Tactic Name: ampere_scudnn_128x32_relu_small_nn_v1 Tactic: 0xa8609adc4e0ceb90
[02/27/2025-14:25:52] [V] [TRT] Tactic: 0xa8609adc4e0ceb90 Time: 0.0100843
[02/27/2025-14:25:52] [V] [TRT] /fc1/Gemm + /relu/Relu Set Tactic Name: ampere_scudnn_128x64_relu_interior_nn_v1 Tactic: 0xc3cf6e1d1c6aff27
[02/27/2025-14:25:52] [V] [TRT] Tactic: 0xc3cf6e1d1c6aff27 Time: 0.0107948
[02/27/2025-14:25:52] [V] [TRT] /fc1/Gemm + /relu/Relu Set Tactic Name: ampere_scudnn_128x64_relu_medium_nn_v1 Tactic: 0xf64396b97c889179
[02/27/2025-14:25:52] [V] [TRT] Tactic: 0xf64396b97c889179 Time: 0.0117215
[02/27/2025-14:25:52] [V] [TRT] /fc1/Gemm + /relu/Relu Set Tactic Name: ampere_scudnn_128x128_relu_small_nn_v1 Tactic: 0x503619c69ae500ff
[02/27/2025-14:25:52] [V] [TRT] Tactic: 0x503619c69ae500ff Time: 0.0122099
[02/27/2025-14:25:52] [V] [TRT] /fc1/Gemm + /relu/Relu Set Tactic Name: ampere_scudnn_128x32_relu_interior_nn_v1 Tactic: 0x9808072e706def96
[02/27/2025-14:25:52] [V] [TRT] Tactic: 0x9808072e706def96 Time: 0.0100017
[02/27/2025-14:25:52] [V] [TRT] /fc1/Gemm + /relu/Relu Set Tactic Name: ampere_scudnn_128x128_relu_interior_nn_v1 Tactic: 0xa8ef60e712f8ad24
[02/27/2025-14:25:52] [V] [TRT] Tactic: 0xa8ef60e712f8ad24 Time: 0.0122263
[02/27/2025-14:25:52] [V] [TRT] /fc1/Gemm + /relu/Relu Set Tactic Name: ampere_scudnn_128x128_relu_medium_nn_v1 Tactic: 0xf067e6205da31c2e
[02/27/2025-14:25:52] [V] [TRT] Tactic: 0xf067e6205da31c2e Time: 0.0123044
[02/27/2025-14:25:52] [V] [TRT] /fc1/Gemm + /relu/Relu Set Tactic Name: sm80_xmma_fprop_implicit_gemm_indexed_f32f32_f32f32_f32_nchwkcrs_nchw_tilesize64x64x8_stage3_warpsize1x4x1_g1_ffma_aligna4_alignc4 Tactic: 0xd828f024626fa982
[02/27/2025-14:25:52] [V] [TRT] Tactic: 0xd828f024626fa982 Time: 0.00812775
[02/27/2025-14:25:52] [V] [TRT] /fc1/Gemm + /relu/Relu Set Tactic Name: sm80_xmma_fprop_implicit_gemm_f32f32_f32f32_f32_nchwkcrs_nchw_tilesize32x32x8_stage3_warpsize1x2x1_g1_ffma_aligna4_alignc4 Tactic: 0xb0bf940d5e0f9f45
[02/27/2025-14:25:52] [V] [TRT] Tactic: 0xb0bf940d5e0f9f45 Time: 0.00725326
[02/27/2025-14:25:52] [V] [TRT] /fc1/Gemm + /relu/Relu Set Tactic Name: sm80_xmma_fprop_implicit_gemm_f32f32_f32f32_f32_nchwkcrs_nchw_tilesize64x256x8_stage3_warpsize1x4x1_g1_ffma_simple_t1r1s1_aligna4_alignc4 Tactic: 0x9de226a0c44627c4
[02/27/2025-14:25:52] [V] [TRT] Tactic: 0x9de226a0c44627c4 Time: 0.0143634
[02/27/2025-14:25:52] [V] [TRT] /fc1/Gemm + /relu/Relu Set Tactic Name: ampere_scudnn_128x64_relu_small_nn_v1 Tactic: 0x3f243c490d502deb
[02/27/2025-14:25:52] [V] [TRT] Tactic: 0x3f243c490d502deb Time: 0.011565
[02/27/2025-14:25:52] [V] [TRT] /fc1/Gemm + /relu/Relu Set Tactic Name: sm80_xmma_fprop_implicit_gemm_indexed_f32f32_f32f32_f32_nchwkcrs_nchw_tilesize128x16x8_stage3_warpsize4x1x1_g1_ffma_aligna4_alignc4 Tactic: 0x40a12e3938221818
[02/27/2025-14:25:52] [V] [TRT] Tactic: 0x40a12e3938221818 Time: 0.00818108
[02/27/2025-14:25:52] [V] [TRT] /fc1/Gemm + /relu/Relu Set Tactic Name: sm80_xmma_fprop_implicit_gemm_f32f32_f32f32_f32_nchwkcrs_nchw_tilesize128x64x8_stage3_warpsize2x2x1_g1_ffma_t1r1s1_aligna4_alignc4 Tactic: 0xe5603263b7f00303
[02/27/2025-14:25:52] [V] [TRT] Tactic: 0xe5603263b7f00303 Time: 0.0121726
[02/27/2025-14:25:52] [V] [TRT] /fc1/Gemm + /relu/Relu Set Tactic Name: sm80_xmma_fprop_implicit_gemm_f32f32_f32f32_f32_nchwkcrs_nchw_tilesize64x64x8_stage3_warpsize1x4x1_g1_ffma_t1r1s1_aligna4_alignc4 Tactic: 0x865894c4635db7fd
[02/27/2025-14:25:52] [V] [TRT] Tactic: 0x865894c4635db7fd Time: 0.00784024
[02/27/2025-14:25:52] [V] [TRT] /fc1/Gemm + /relu/Relu Set Tactic Name: sm80_xmma_fprop_implicit_gemm_f32f32_f32f32_f32_nchwkcrs_nchw_tilesize128x16x8_stage3_warpsize4x1x1_g1_ffma_aligna4_alignc4 Tactic: 0x9d9fdb5fd9945f64
[02/27/2025-14:25:52] [V] [TRT] Tactic: 0x9d9fdb5fd9945f64 Time: 0.00734469
[02/27/2025-14:25:52] [V] [TRT] /fc1/Gemm + /relu/Relu Set Tactic Name: sm80_xmma_fprop_implicit_gemm_f32f32_f32f32_f32_nchwkcrs_nchw_tilesize64x64x8_stage3_warpsize1x4x1_g1_ffma_aligna4_alignc4 Tactic: 0xa31d27de74b895ff
[02/27/2025-14:25:52] [V] [TRT] Tactic: 0xa31d27de74b895ff Time: 0.00794692
[02/27/2025-14:25:52] [V] [TRT] /fc1/Gemm + /relu/Relu Set Tactic Name: sm80_xmma_fprop_implicit_gemm_f32f32_f32f32_f32_nchwkcrs_nchw_tilesize64x128x8_stage3_warpsize1x4x1_g1_ffma_aligna4_alignc4 Tactic: 0x5aa723e0481da855
[02/27/2025-14:25:52] [V] [TRT] Tactic: 0x5aa723e0481da855 Time: 0.0118593
[02/27/2025-14:25:52] [V] [TRT] /fc1/Gemm + /relu/Relu Set Tactic Name: sm80_xmma_fprop_implicit_gemm_f32f32_f32f32_f32_nchwkcrs_nchw_tilesize32x32x8_stage3_warpsize1x2x1_g1_ffma_simple_t1r1s1_aligna4_alignc4 Tactic: 0x90f8f2915f87ed77
[02/27/2025-14:25:52] [V] [TRT] Tactic: 0x90f8f2915f87ed77 Time: 0.00710901
[02/27/2025-14:25:52] [V] [TRT] /fc1/Gemm + /relu/Relu Set Tactic Name: sm80_xmma_fprop_implicit_gemm_f32f32_f32f32_f32_nchwkcrs_nchw_tilesize64x64x8_stage3_warpsize1x4x1_g1_ffma_simple_t1r1s1_aligna4_alignc4 Tactic: 0x1fc87d7eb370bb7a
[02/27/2025-14:25:52] [V] [TRT] Tactic: 0x1fc87d7eb370bb7a Time: 0.00753251
[02/27/2025-14:25:52] [V] [TRT] /fc1/Gemm + /relu/Relu Set Tactic Name: sm80_xmma_fprop_implicit_gemm_f32f32_f32f32_f32_nchwkcrs_nchw_tilesize64x256x8_stage3_warpsize1x4x1_g1_ffma_t1r1s1_aligna4_alignc4 Tactic: 0x2ee10e11d6651675
[02/27/2025-14:25:52] [V] [TRT] Tactic: 0x2ee10e11d6651675 Time: 0.0167761
